{
  "$schema": "https://json-schema.org/draft/2020-12/schema",
  "$id": "https://runecode.dev/protocol/schemas/objects/LLMRequest.schema.json",
  "title": "LLMRequest",
  "description": "Protocol-owned model request family for typed gateway requests that reference artifacts by hash, keep model selection bounded by signed allowlists, and carry explicit MVP limits.",
  "type": "object",
  "additionalProperties": false,
  "maxProperties": 12,
  "allOf": [
    {
      "if": {
        "properties": {
          "response_mode": {
            "const": "structured_output"
          }
        },
        "required": [
          "response_mode"
        ]
      },
      "then": {
        "required": [
          "output_schema_id",
          "output_schema_version"
        ]
      }
    },
    {
      "if": {
        "properties": {
          "response_mode": {
            "const": "text"
          }
        },
        "required": [
          "response_mode"
        ]
      },
      "then": {
        "not": {
          "anyOf": [
            {
              "required": [
                "output_schema_id"
              ]
            },
            {
              "required": [
                "output_schema_version"
              ]
            }
          ]
        }
      }
    }
  ],
  "$defs": {
    "toolAllowlistEntry": {
      "description": "Schema-validated tool entry that the model may propose but never execute directly.",
      "type": "object",
      "additionalProperties": false,
      "maxProperties": 4,
      "required": [
        "tool_name",
        "arguments_schema_id",
        "arguments_schema_version"
      ],
      "properties": {
        "tool_name": {
          "type": "string",
          "minLength": 1,
          "maxLength": 128,
          "description": "Stable tool identifier allowlisted for this request.",
          "x-data-class": "public"
        },
        "arguments_schema_id": {
          "type": "string",
          "minLength": 1,
          "maxLength": 256,
          "description": "Schema identifier used to validate proposed tool-call arguments for this tool.",
          "x-data-class": "public"
        },
        "arguments_schema_version": {
          "type": "string",
          "minLength": 1,
          "maxLength": 64,
          "description": "Exact schema version used to validate proposed tool-call arguments for this tool.",
          "x-data-class": "public"
        },
        "tool_description": {
          "type": "string",
          "minLength": 1,
          "maxLength": 512,
          "description": "Human-facing summary of the allowlisted tool capability exposed to the model.",
          "x-data-class": "public"
        }
      }
    },
    "requestLimits": {
      "description": "Explicit MVP request and streaming limit profile carried with every model request.",
      "type": "object",
      "additionalProperties": false,
      "maxProperties": 7,
      "required": [
        "max_request_bytes",
        "max_tool_calls",
        "max_total_tool_call_argument_bytes",
        "max_structured_output_bytes",
        "max_streamed_bytes",
        "max_stream_chunk_bytes",
        "stream_idle_timeout_ms"
      ],
      "properties": {
        "max_request_bytes": {
          "type": "integer",
          "const": 262144,
          "description": "Maximum serialized LLMRequest payload size in bytes, excluding referenced artifact bytes.",
          "x-data-class": "public"
        },
        "max_tool_calls": {
          "type": "integer",
          "const": 8,
          "description": "Maximum number of tool-call proposals that one response may contain.",
          "x-data-class": "public"
        },
        "max_total_tool_call_argument_bytes": {
          "type": "integer",
          "const": 65536,
          "description": "Maximum combined size in bytes for all proposed tool-call argument payloads in one response.",
          "x-data-class": "public"
        },
        "max_structured_output_bytes": {
          "type": "integer",
          "const": 262144,
          "description": "Maximum size in bytes for any final structured-output payload or proposal object.",
          "x-data-class": "public"
        },
        "max_streamed_bytes": {
          "type": "integer",
          "const": 16777216,
          "description": "Maximum total streamed response bytes allowed for this request.",
          "x-data-class": "public"
        },
        "max_stream_chunk_bytes": {
          "type": "integer",
          "const": 65536,
          "description": "Maximum payload size in bytes for one streamed event chunk.",
          "x-data-class": "public"
        },
        "stream_idle_timeout_ms": {
          "type": "integer",
          "const": 15000,
          "description": "Maximum idle time in milliseconds between streamed events before broker enforcement terminates the stream.",
          "x-data-class": "public"
        }
      }
    }
  },
  "required": [
    "schema_id",
    "schema_version",
    "selection_source",
    "provider",
    "model",
    "input_artifacts",
    "tool_allowlist",
    "response_mode",
    "streaming_mode",
    "request_limits"
  ],
  "properties": {
    "schema_id": {
      "const": "runecode.protocol.v0.LLMRequest",
      "description": "Stable protocol object-family identifier for model request objects.",
      "x-data-class": "public"
    },
    "schema_version": {
      "const": "0.3.0",
      "description": "Exact protocol schema version used to validate this model request object.",
      "x-data-class": "public"
    },
    "selection_source": {
      "type": "string",
      "const": "signed_allowlist",
      "description": "Provider and model selection must come from a signed allowlist rather than arbitrary caller input.",
      "x-data-class": "public"
    },
    "provider": {
      "type": "string",
      "minLength": 1,
      "maxLength": 128,
      "description": "Provider family selected for this request under the active signed gateway allowlist.",
      "x-data-class": "public"
    },
    "model": {
      "type": "string",
      "minLength": 1,
      "maxLength": 256,
      "description": "Provider-specific model identifier selected under the active signed gateway allowlist.",
      "x-data-class": "public"
    },
    "input_artifacts": {
      "type": "array",
      "minItems": 1,
      "maxItems": 64,
      "description": "Ordered artifact references that provide all prompt, context, and attachment inputs for the model request.",
      "x-data-class": "sensitive",
      "items": {
        "$ref": "ArtifactReference.schema.json",
        "description": "Artifact reference supplying one model input by hash instead of embedding raw prompt bytes."
      },
      "uniqueItems": true
    },
    "tool_allowlist": {
      "type": "array",
      "maxItems": 8,
      "description": "Explicit per-request allowlist of tool schemas that the model may propose.",
      "x-data-class": "public",
      "items": {
        "$ref": "#/$defs/toolAllowlistEntry",
        "description": "One allowlisted tool definition for this request."
      },
      "uniqueItems": true
    },
    "response_mode": {
      "type": "string",
      "enum": [
        "text",
        "structured_output"
      ],
      "description": "Expected final response shape. Structured output requires explicit output schema references.",
      "x-data-class": "public"
    },
    "output_schema_id": {
      "type": "string",
      "minLength": 1,
      "maxLength": 256,
      "description": "Schema identifier for machine-consumed structured output when response_mode is structured_output.",
      "x-data-class": "public"
    },
    "output_schema_version": {
      "type": "string",
      "minLength": 1,
      "maxLength": 64,
      "description": "Exact schema version for machine-consumed structured output when response_mode is structured_output.",
      "x-data-class": "public"
    },
    "streaming_mode": {
      "type": "string",
      "enum": [
        "final_only",
        "stream"
      ],
      "description": "Whether the request expects only a final response object or a streamed event sequence plus terminal status.",
      "x-data-class": "public"
    },
    "request_limits": {
      "$ref": "#/$defs/requestLimits",
      "description": "Explicit MVP request, proposal, and streaming limits for this model request.",
      "x-data-class": "public"
    }
  }
}
